{
  "schemaVersion": "1.0.0",
  "jobId": "2a354ebb-26bc-4b8d-a31d-18a983f93d83",
  "state": "ReviewRequired",
  "version": 4,
  "createdAtUtc": "2026-08-11T20:00:00Z",
  "updatedAtUtc": "2026-08-11T20:05:00Z",
  "source": { "path": "C:\\Drawings\\sample-input.dwg", "contentHash": "sha256:aaaaaaaaaaaaaaaaaaaaaaaaaaaaaaaaaaaaaaaaaaaaaaaaaaaaaaaaaaaaaaaa", "sizeBytes": 1048576, "dwgVersion": "AC1032" },
  "output": { "requestedPath": "C:\\Drawings\\Output\\sample-input.es.dwg", "overwritePolicy": "FailIfExists" },
  "translation": { "sourceLanguage": "en", "targetLanguage": "es-MX", "adapter": "OpenAI", "model": "configured-model-id", "promptTemplateVersion": "translate-cad-text/1.0", "glossaryHash": null },
  "contractVersions": { "ipc": "1.0.0", "job": "1.0.0", "translation": "1.0.0" },
  "counts": { "selected": 2, "approved": 1, "excluded": 0, "unsupported": 3, "errors": 0 },
  "secretReference": "credential-manager:dwg-translator/openai"
}
